{"baselines":["1850-1900","1951-1980","1991-2020"],"n_months":2121,"schema_version":"v1","series":[{"ci_hi":null,"ci_lo":null,"id":"gistemp_glb","label":"GISTEMP global land-ocean","native_baseline":"1951-1980","source":"NASA GISTEMP v4","values":{"1951-1980":[null,null,null,null,null,null,null,null,null,null,null,null,null,null,null,null,null,null,null,null,null,null,null,null,null,null,null,null,null,null,null,null,null,null,null,null,null,null,null,null,null,null,null,null,null,null,null,null,null,null,null,null,null,null,null,null,null,null,null,null,null,null,null,null,null,null,null,null,null,null,null,null,null,null,null,null,null,null,null,null,null,null,null,null,null,null,null,null,null,null,null,null,null,null,null,null,null,null,null,null,null,null,null,null,null,null,null,null,null,null,null,null,null,null,null,null,null,null,null,null,null,null,null,null,null,null,null,null,null,null,null,null,null,null,null,null,null,null,null,null,null,null,null,null,null,null,null,null,null,null,null,null,null,null,null,null,null,null,null,null,null,null,null,null,null,null,null,null,null,null,null,null,null,null,null,null,null,null,null,null,null,null,null,null,null,null,null,null,null,null,null,null,null,null,null,null,null,null,null,null,null,null,null,null,null,null,null,null,null,null,null,null,null,null,null,null,null,null,null,null,null,null,null,null,null,null,null,null,null,null,null,null,null,null,null,null,null,null,null,null,null,null,null,null,null,null,null,null,null,null,null,null,null,null,null,null,null,null,null,null,null,null,null,null,null,null,null,null,null,null,null,null,null,null,null,null,null,null,null,null,null,null,null,null,null,null,null,null,null,null,null,null,null,null,null,null,null,null,null,null,null,null,null,null,null,null,null,null,null,null,null,null,null,null,null,null,null,null,null,null,null,null,null,null,null,null,null,null,null,null,null,null,null,null,null,null,null,null,null,null,null,null,null,null,null,null,null,null,null,null,null,null,null,null,null,null,null,null,null,null,-0.19,-0.25,-0.09,-0.16,-0.101,-0.21,-0.19,-0.1,-0.15,-0.23,-0.219,-0.18,-0.2,-0.14,0.03,0.05,0.059,-0.19,0.0,-0.03,-0.15,-0.22,-0.189,-0.07,0.16,0.13,0.04,-0.16,-0.141,-0.22,-0.16,-0.08,-0.15,-0.23,-0.169,-0.36,-0.29,-0.37,-0.12,-0.18,-0.181,-0.07,-0.08,-0.14,-0.22,-0.11,-0.239,-0.11,-0.13,-0.08,-0.36,-0.4,-0.331,-0.35,-0.3,-0.28,-0.27,-0.25,-0.329,-0.31,-0.58,-0.34,-0.27,-0.42,-0.451,-0.44,-0.34,-0.31,-0.28,-0.23,-0.239,-0.1,-0.44,-0.51,-0.43,-0.28,-0.241,-0.35,-0.18,-0.3,-0.23,-0.27,-0.279,-0.25,-0.72,-0.57,-0.35,-0.35,-0.301,-0.25,-0.26,-0.35,-0.25,-0.35,-0.259,-0.33,-0.34,-0.36,-0.42,-0.21,-0.221,-0.17,-0.11,-0.16,-0.12,0.01,0.021,-0.04,-0.09,0.16,0.06,0.09,-0.011,-0.1,-0.08,-0.2,-0.24,-0.25,-0.339,-0.29,-0.42,-0.45,-0.4,-0.3,-0.391,-0.25,-0.28,-0.39,-0.37,-0.25,-0.439,-0.32,-0.34,-0.46,-0.18,-0.27,-0.161,-0.21,-0.18,-0.17,-0.15,-0.22,-0.309,-0.04,-0.29,-0.12,-0.4,-0.33,-0.231,-0.22,-0.31,-0.27,-0.16,-0.13,-0.419,-0.39,-0.81,-0.56,-0.22,-0.27,-0.341,-0.25,-0.14,-0.25,-0.22,-0.18,-0.179,-0.32,-0.52,-0.29,-0.23,-0.45,-0.311,-0.4,-0.24,-0.24,-0.27,-0.22,-0.259,-0.21,-0.41,-0.42,-0.32,-0.22,-0.271,-0.21,-0.17,-0.17,-0.12,-0.1,-0.169,-0.14,-0.22,-0.12,-0.26,-0.3,-0.161,-0.11,-0.02,-0.05,-0.07,0.06,-0.039,-0.05,-0.15,-0.17,-0.13,-0.02,-0.021,-0.12,-0.03,-0.09,-0.08,-0.13,-0.179,-0.21,-0.03,-0.3,-0.51,-0.3,-0.301,-0.19,-0.22,-0.27,-0.21,-0.35,-0.379,-0.24,-0.17,-0.38,-0.37,-0.2,-0.231,-0.32,-0.16,-0.08,-0.04,-0.04,0.121,-0.26,-0.36,-0.06,0.0,-0.09,-0.091,-0.1,-0.13,-0.09,-0.05,0.1,-0.069,-0.07,-0.23,-0.1,0.06,-0.03,-0.151,-0.12,-0.14,-0.2,-0.22,-0.29,-0.169,-0.27,-0.17,-0.08,-0.27,-0.27,-0.321,-0.32,-0.28,-0.3,-0.29,-0.3,-0.369,-0.42,-0.24,-0.06,-0.23,-0.41,-0.401,-0.43,-0.35,-0.45,-0.49,-0.46,-0.419,-0.51,-0.63,-0.58,-0.5,-0.51,-0.521,-0.48,-0.51,-0.49,-0.55,-0.39,-0.179,-0.33,-0.34,-0.59,-0.21,-0.33,-0.291,-0.28,-0.26,-0.2,-0.18,-0.23,-0.059,-0.13,-0.27,-0.29,-0.18,-0.04,-0.251,-0.19,-0.23,-0.19,-0.27,-0.19,-0.369,-0.14,-0.42,-0.5,-0.27,-0.36,-0.451,-0.41,-0.34,-0.34,-0.33,-0.22,-0.459,-0.47,-0.44,-0.32,-0.55,-0.44,-0.371,-0.37,-0.35,-0.45,-0.35,-0.43,-0.509,-0.49,-0.73,-0.45,-0.54,-0.58,-0.541,-0.52,-0.45,-0.33,-0.38,-0.39,-0.319,-0.56,-0.43,-0.42,-0.5,-0.42,-0.341,-0.38,-0.34,-0.36,-0.38,-0.4,-0.569,-0.67,-0.62,-0.58,-0.6,-0.54,-0.521,-0.51,-0.42,-0.43,-0.4,-0.26,-0.209,-0.22,-0.27,-0.16,-0.39,-0.18,-0.211,-0.24,-0.42,-0.54,-0.57,-0.58,-0.399,-0.43,-0.4,-0.45,-0.42,-0.39,-0.441,-0.45,-0.36,-0.33,-0.34,-0.31,-0.199,-0.02,0.04,-0.1,-0.24,-0.3,-0.211,-0.25,-0.23,-0.16,-0.16,-0.03,-0.159,-0.05,-0.21,-0.04,-0.1,0.06,-0.051,-0.22,-0.12,-0.21,-0.19,-0.24,-0.129,-0.21,-0.13,-0.15,-0.28,-0.31,-0.351,-0.49,-0.37,-0.28,-0.36,-0.33,-0.459,-0.81,-0.56,-0.62,-0.64,-0.55,-0.551,-0.43,-0.25,-0.22,-0.22,-0.44,-0.339,-0.67,-0.47,-0.35,-0.26,-0.44,-0.431,-0.36,-0.31,-0.31,-0.17,-0.05,-0.109,-0.3,-0.2,-0.23,-0.21,-0.13,-0.281,-0.36,-0.29,-0.33,-0.24,-0.19,-0.409,-0.42,-0.24,-0.27,-0.11,-0.24,-0.261,-0.35,-0.3,-0.26,-0.21,-0.26,-0.259,-0.46,-0.04,-0.17,-0.22,-0.29,-0.291,-0.27,-0.14,-0.26,-0.18,-0.03,-0.139,-0.17,-0.34,-0.45,-0.15,-0.23,-0.331,-0.3,-0.27,-0.33,-0.35,-0.31,-0.139,-0.19,-0.27,-0.39,-0.33,-0.41,-0.331,-0.29,-0.31,-0.33,-0.31,-0.13,-0.019,-0.03,-0.22,-0.23,-0.08,-0.3,-0.181,-0.26,-0.29,-0.36,-0.32,-0.35,-0.199,-0.43,-0.37,-0.39,-0.27,-0.26,-0.291,-0.33,-0.27,-0.2,-0.19,-0.17,0.051,0.07,0.21,0.03,0.12,-0.13,-0.231,-0.26,-0.27,-0.13,-0.14,-0.11,-0.059,-0.29,-0.27,-0.17,-0.38,-0.3,-0.251,-0.27,-0.19,-0.24,-0.12,0.0,-0.049,-0.33,-0.02,-0.09,-0.25,-0.28,-0.291,-0.39,-0.19,-0.22,-0.21,-0.19,-0.089,-0.16,-0.45,-0.58,-0.33,-0.41,-0.381,-0.43,-0.37,-0.32,-0.25,-0.14,-0.119,-0.54,-0.3,-0.26,-0.1,-0.24,-0.241,-0.21,-0.21,-0.15,-0.15,-0.11,0.181,-0.05,-0.1,-0.2,-0.1,-0.23,-0.191,-0.08,-0.03,-0.03,-0.06,0.06,-0.059,-0.05,0.15,-0.17,-0.18,-0.06,-0.171,-0.29,-0.24,-0.21,-0.1,-0.09,-0.269,-0.26,-0.23,-0.29,-0.29,-0.25,-0.291,-0.34,-0.21,-0.23,-0.29,-0.25,-0.299,-0.44,-0.21,-0.03,-0.29,-0.31,-0.101,-0.15,-0.11,-0.12,-0.15,-0.07,0.031,-0.03,-0.34,0.14,-0.14,-0.37,-0.291,-0.27,-0.21,-0.22,-0.21,-0.06,-0.259,-0.17,-0.28,-0.38,-0.21,-0.2,-0.161,-0.22,-0.1,-0.13,-0.09,-0.03,0.011,-0.01,-0.07,0.03,-0.2,-0.16,-0.061,-0.05,-0.04,0.01,0.09,0.08,0.081,-0.08,0.08,0.04,0.1,0.06,-0.101,-0.17,-0.09,-0.06,0.01,0.15,0.071,-0.12,-0.05,-0.06,-0.18,-0.1,-0.051,-0.07,-0.06,-0.06,-0.07,-0.04,0.071,0.42,-0.01,0.08,0.09,0.17,0.099,0.11,0.12,0.07,0.15,0.11,0.161,0.31,0.17,0.3,0.1,0.16,0.159,0.12,0.22,0.14,0.02,0.35,0.221,0.21,0.29,0.02,0.05,0.09,0.109,0.05,0.0,-0.04,-0.03,0.01,0.091,0.12,-0.01,0.17,-0.04,0.11,0.059,-0.05,0.08,0.01,0.05,0.23,0.201,0.23,0.36,0.24,0.26,0.19,0.179,0.15,0.17,0.18,0.28,0.26,0.121,0.04,0.1,0.01,0.06,0.19,0.059,0.01,0.04,0.26,0.21,0.19,0.071,-0.07,0.15,0.03,0.01,0.06,-0.071,-0.21,-0.12,-0.2,-0.07,-0.07,-0.049,-0.31,-0.06,-0.08,0.07,0.06,-0.021,-0.02,-0.05,-0.07,-0.12,0.07,0.021,-0.13,0.06,-0.15,-0.24,-0.12,-0.011,-0.05,-0.11,-0.11,-0.14,-0.05,-0.129,-0.24,0.06,-0.14,-0.02,-0.11,-0.101,-0.27,-0.13,-0.13,-0.14,-0.07,-0.099,-0.18,-0.26,-0.27,-0.08,-0.21,-0.111,-0.05,-0.09,-0.16,-0.11,-0.2,-0.339,-0.22,-0.34,-0.42,-0.2,-0.14,-0.001,-0.07,-0.01,0.06,0.05,0.08,-0.009,0.15,0.11,0.11,-0.08,0.03,-0.031,-0.03,0.04,0.05,0.07,0.0,-0.129,-0.02,0.07,0.15,0.11,0.2,0.119,0.12,0.01,0.05,0.05,0.08,-0.029,0.05,-0.24,-0.1,-0.15,-0.14,-0.201,-0.19,-0.19,-0.17,-0.1,-0.02,0.081,-0.18,0.13,-0.16,-0.32,-0.22,-0.201,-0.13,-0.11,0.02,-0.11,-0.05,-0.249,-0.28,-0.13,-0.24,-0.21,-0.28,-0.291,-0.15,-0.09,-0.25,-0.19,-0.23,-0.149,-0.06,-0.09,-0.03,-0.05,0.0,0.089,0.15,0.02,0.15,0.09,0.01,0.081,0.15,0.39,0.22,0.09,0.02,0.059,-0.09,0.05,-0.05,-0.03,0.04,0.021,0.01,0.08,0.07,0.18,0.16,0.039,0.03,0.03,-0.01,-0.06,-0.07,-0.079,-0.0,0.0,0.13,-0.35,-0.15,-0.081,-0.04,-0.04,0.02,0.07,0.06,-0.109,0.19,0.07,0.19,0.09,0.13,0.119,0.11,0.01,0.01,0.08,0.0,0.031,-0.16,0.05,0.15,0.1,0.05,-0.061,0.03,0.02,-0.01,0.0,0.01,0.061,-0.03,-0.03,0.18,-0.14,-0.07,-0.061,0.05,0.06,0.22,0.17,0.14,0.151,-0.03,-0.09,-0.1,-0.21,-0.32,-0.251,-0.04,-0.04,-0.22,-0.3,-0.32,-0.209,-0.3,-0.08,-0.17,-0.13,-0.19,-0.121,-0.09,-0.14,-0.04,-0.15,-0.05,-0.059,-0.08,-0.19,-0.04,0.03,-0.13,-0.121,0.01,0.08,-0.09,-0.03,-0.17,-0.009,-0.02,-0.07,-0.21,0.05,-0.05,0.119,-0.08,0.02,0.01,-0.06,0.09,-0.049,-0.05,-0.26,-0.14,0.2,-0.06,-0.141,-0.09,-0.13,-0.09,-0.19,0.09,-0.049,-0.14,-0.11,-0.18,0.01,0.17,0.179,0.03,-0.04,0.04,0.08,0.09,0.121,0.24,0.08,0.22,0.06,0.05,-0.031,-0.02,0.02,-0.1,0.12,0.03,0.021,-0.12,-0.02,-0.15,-0.18,-0.07,-0.051,-0.16,-0.08,-0.01,-0.05,-0.04,-0.069,-0.08,-0.22,-0.18,0.03,0.0,-0.031,0.04,0.01,0.16,0.02,0.08,0.021,0.18,0.29,0.32,0.29,0.27,0.229,0.19,0.13,0.05,0.09,0.1,0.041,-0.07,-0.1,-0.27,-0.05,-0.12,-0.041,-0.05,-0.03,0.1,-0.08,-0.06,-0.079,-0.08,0.1,0.08,0.13,0.04,0.159,-0.01,-0.01,-0.17,-0.02,-0.11,-0.169,-0.17,-0.03,-0.06,-0.21,-0.07,-0.201,-0.12,-0.1,-0.12,-0.06,-0.24,-0.059,0.11,0.18,0.23,0.24,0.26,0.329,0.27,0.2,0.18,0.02,0.03,0.161,0.03,0.06,0.1,0.19,0.17,0.089,-0.01,0.04,-0.14,0.06,0.03,0.131,0.08,0.08,-0.1,0.19,0.15,0.039,0.14,0.04,0.17,0.25,0.26,0.281,0.47,0.3,0.39,0.29,0.3,0.349,0.2,0.22,0.18,0.2,0.13,0.301,0.22,0.53,0.42,0.48,0.32,0.239,0.29,0.33,0.35,0.15,0.12,0.231,0.41,0.05,0.15,0.03,0.15,0.179,0.06,0.14,0.03,0.14,0.13,0.181,0.43,0.53,0.43,0.42,0.28,0.339,0.23,0.18,0.36,0.37,0.17,0.301,0.17,0.31,0.14,0.26,0.06,0.329,0.02,0.19,0.19,0.21,0.13,0.061,-0.04,0.22,-0.04,0.17,0.12,0.149,0.15,0.04,0.17,0.13,0.12,0.051,0.14,0.26,0.37,0.3,0.22,0.209,0.12,0.11,0.16,0.03,0.15,0.101,0.13,0.32,0.43,0.18,0.24,0.259,0.35,0.4,0.25,0.35,0.33,0.291,0.46,0.57,0.44,0.51,0.42,0.439,0.4,0.33,0.39,0.37,0.38,0.121,0.29,0.12,0.3,0.36,0.29,0.169,0.15,0.35,0.33,0.34,0.29,0.201,0.37,0.41,0.44,0.8,0.56,0.459,0.37,0.46,0.34,0.23,0.45,0.461,0.4,0.42,0.5,0.35,0.51,0.339,0.53,0.48,0.39,0.44,0.29,0.301,0.32,0.47,0.4,0.48,0.27,0.309,0.26,0.09,0.08,-0.01,0.07,0.031,0.22,0.34,0.37,0.36,0.28,0.279,0.23,0.25,0.11,0.11,0.23,0.031,0.18,0.26,0.02,0.29,0.41,0.279,0.43,0.3,0.21,0.31,0.42,0.441,